Category,Finding,Implication,Recommendation
Geographic Disparity,Top 5 states account for 55.3% of total enrollments,Service delivery heavily concentrated in certain regions,Expand mobile enrollment units to underserved states
Inequality,Average Gini coefficient of 0.452 indicates moderate inequality,Enrollment access varies significantly within states,Target districts with Gini > 0.4 for intervention
Age Demographics,Youth (5-17) enrollments at 33.7% suggest active school outreach,School-based enrollment programs showing effectiveness,Continue and expand school-based enrollment drives
Service Patterns,716 districts classified as underserved,Significant portion of districts need service enhancement,Prioritize these districts for new enrollment center setup
Predictive Capability,Demand forecasting model achieves 99.2% accuracy,Future enrollment demand can be reliably predicted,Use model for resource allocation and capacity planning
